{
 "meta": {
  "schema": "optiondesk/greeks_ladder/v1",
  "generated_utc": "2026-09-08T22:15:38+00:00",
  "tool": "optiondesk greeks",
  "shell_version": "0.3.0",
  "engine_version": "0.3.0",
  "provider_used": "user snapshot",
  "degraded": false,
  "degraded_reason": null,
  "notes": [
   "Synthetic teaching inputs. No observed quotes, holdings, or price history. Not market-performance evidence.",
   "row 1: calculated mid from bid and ask",
   "row 2: calculated mid from bid and ask",
   "row 3: calculated mid from bid and ask",
   "row 4: calculated mid from bid and ask",
   "row 5: calculated mid from bid and ask",
   "row 6: calculated mid from bid and ask",
   "row 7: calculated mid from bid and ask",
   "row 8: calculated mid from bid and ask",
   "row 9: calculated mid from bid and ask",
   "row 10: calculated mid from bid and ask",
   "row 11: calculated mid from bid and ask",
   "row 12: calculated mid from bid and ask",
   "row 13: calculated mid from bid and ask",
   "row 14: calculated mid from bid and ask",
   "row 15: calculated mid from bid and ask",
   "row 16: calculated mid from bid and ask",
   "row 17: calculated mid from bid and ask",
   "row 18: calculated mid from bid and ask",
   "row 19: calculated mid from bid and ask",
   "row 20: calculated mid from bid and ask",
   "row 21: calculated mid from bid and ask",
   "row 22: calculated mid from bid and ask",
   "row 23: calculated mid from bid and ask",
   "row 24: calculated mid from bid and ask",
   "row 25: calculated mid from bid and ask",
   "row 26: calculated mid from bid and ask",
   "row 27: calculated mid from bid and ask",
   "row 28: calculated mid from bid and ask",
   "row 29: calculated mid from bid and ask",
   "row 30: calculated mid from bid and ask",
   "row 31: calculated mid from bid and ask",
   "row 32: calculated mid from bid and ask",
   "row 33: calculated mid from bid and ask",
   "row 34: calculated mid from bid and ask",
   "row 35: calculated mid from bid and ask",
   "row 36: calculated mid from bid and ask",
   "row 37: calculated mid from bid and ask",
   "row 38: calculated mid from bid and ask",
   "row 39: calculated mid from bid and ask",
   "row 40: calculated mid from bid and ask",
   "row 41: calculated mid from bid and ask",
   "row 42: calculated mid from bid and ask",
   "row 43: calculated mid from bid and ask",
   "row 44: calculated mid from bid and ask",
   "row 45: calculated mid from bid and ask",
   "row 46: calculated mid from bid and ask",
   "row 47: calculated mid from bid and ask",
   "row 48: calculated mid from bid and ask",
   "row 49: calculated mid from bid and ask",
   "row 50: calculated mid from bid and ask",
   "row 51: calculated mid from bid and ask",
   "row 52: calculated mid from bid and ask",
   "row 53: calculated mid from bid and ask",
   "row 54: calculated mid from bid and ask",
   "row 55: calculated mid from bid and ask",
   "row 56: calculated mid from bid and ask",
   "row 57: calculated mid from bid and ask",
   "row 58: calculated mid from bid and ask",
   "row 59: calculated mid from bid and ask",
   "row 60: calculated mid from bid and ask",
   "row 61: calculated mid from bid and ask",
   "row 62: calculated mid from bid and ask",
   "40 contracts outside the 0.1 band around spot"
  ],
  "inputs": {
   "snapshot": "examples/dashboard/chain_SYNTH_2026-11-07.json",
   "band": 0.1,
   "type": "both"
  },
  "disclaimer": "Research output, not investment advice, and not a recommendation or solicitation. Option premiums here are theoretical model values, not quotes and not achievable fills. Market data is third-party, may be delayed or wrong, and its redistribution is governed by the provider's terms. No warranty. See DISCLAIMER.md.",
  "license": "Produced by optiondesk under the PolyForm Noncommercial License 1.0.0. Noncommercial use is permitted; commercial use requires a separate written agreement with the copyright holder. See LICENSE and LICENSES.md."
 },
 "source_artifact": "examples/dashboard/chain_SYNTH_2026-11-07.json",
 "underlying": "SYNTH",
 "expiry": "2026-11-07",
 "days_to_expiry": 60.0,
 "spot": 100.0,
 "risk_free_rate": 0.04,
 "dividend_yield": 0.01,
 "units": {
  "price": "model value in the underlying quote currency",
  "delta": "dV/dS per 1.0 of underlying",
  "gamma": "d2V/dS2, delta change per 1.0 of underlying",
  "vega": "dV/dsigma per 1.00 of volatility; divide by 100 for per point",
  "theta": "value change per calendar day; negative is decay",
  "rho": "dV/dr per 1.00 of rate",
  "lam": "elasticity, delta times spot over value; dimensionless",
  "vanna": "d2V/dS dsigma",
  "vomma": "d2V/dsigma2, also called volga",
  "charm": "delta change per calendar day",
  "veta": "vega change per calendar day",
  "speed": "d3V/dS3, gamma change per 1.0 of underlying",
  "zomma": "dGamma/dsigma",
  "color": "gamma change per calendar day",
  "ultima": "d3V/dsigma3",
  "dual_delta": "dV/dK per 1.0 of strike",
  "dual_gamma": "d2V/dK2",
  "iv": "implied volatility per 1.00, so 0.20 is 20 percent",
  "moneyness": "strike divided by spot; dimensionless",
  "days_to_expiry": "calendar days"
 },
 "skipped": {
  "no_iv": 0,
  "expired": 0,
  "out_of_band": 40,
  "error": 0
 },
 "rows": [
  {
   "symbol": "SYNTHC90",
   "type": "call",
   "strike": 90.0,
   "expiry": "2026-11-07",
   "days_to_expiry": 60.0,
   "iv": 0.2785,
   "moneyness": 0.9,
   "price": 11.35351506073171,
   "delta": 0.847855109822124,
   "gamma": 0.020683628379057326,
   "vega": 9.46913507435748,
   "theta": -0.027700735625355622,
   "rho": 12.071013028188606,
   "lam": 7.467776325541612,
   "vanna": -0.7717707363741154,
   "vomma": 32.33040503145753,
   "charm": 0.0016443777327533264,
   "veta": -0.1465619060764639,
   "speed": -0.002099467413640704,
   "zomma": -0.003647990370750438,
   "color": 2.4588924702365866e-05,
   "ultima": -239.43397367221564,
   "dual_delta": -0.8159110657942299,
   "dual_gamma": 0.02553534367784855
  },
  {
   "symbol": "SYNTHC92",
   "type": "call",
   "strike": 92.0,
   "expiry": "2026-11-07",
   "days_to_expiry": 60.0,
   "iv": 0.27424,
   "moneyness": 0.92,
   "price": 9.72721410504559,
   "delta": 0.8009804621281958,
   "gamma": 0.02496314921366357,
   "vega": 11.25352444989879,
   "theta": -0.03123545953511691,
   "rho": 11.567808017716272,
   "lam": 8.23442820810041,
   "vanna": -0.7476171089890309,
   "vomma": 25.76055650273653,
   "charm": 0.0015253224010587983,
   "veta": -0.145272767767256,
   "speed": -0.002157665872139108,
   "zomma": -0.03388325557115002,
   "color": 9.380092965105098e-05,
   "ultima": -224.68419822776502,
   "dual_delta": -0.7649003489975433,
   "dual_gamma": 0.029493323740150717
  },
  {
   "symbol": "SYNTHC94",
   "type": "call",
   "strike": 94.0,
   "expiry": "2026-11-07",
   "days_to_expiry": 60.0,
   "iv": 0.27026,
   "moneyness": 0.94,
   "price": 8.206998783469189,
   "delta": 0.7455815922113002,
   "gamma": 0.02914791981136519,
   "vega": 12.949342698443107,
   "theta": -0.034392748734910196,
   "rho": 10.907040071944245,
   "lam": 9.084704553789816,
   "vanna": -0.6557751810033422,
   "vomma": 17.667115419284034,
   "charm": 0.001257769952765267,
   "veta": -0.1408914385534643,
   "speed": -0.002059055124478,
   "zomma": -0.0680841582104914,
   "color": 0.00016866346610782887,
   "ultima": -174.13740055950274,
   "dual_delta": -0.7058634089112854,
   "dual_gamma": 0.03298768652259528
  },
  {
   "symbol": "SYNTHC96",
   "type": "call",
   "strike": 96.0,
   "expiry": "2026-11-07",
   "days_to_expiry": 60.0,
   "iv": 0.26656,
   "moneyness": 0.96,
   "price": 6.809587413057663,
   "delta": 0.6823344851229597,
   "gamma": 0.03288397353923681,
   "vega": 14.409126553346244,
   "theta": -0.03686944560715707,
   "rho": 10.097073057409036,
   "lam": 10.020203042177787,
   "vanna": -0.4923889892187069,
   "vomma": 9.530352800008947,
   "charm": 0.0008421749356315721,
   "veta": -0.13562002981419574,
   "speed": -0.0017813913371864721,
   "zomma": -0.10161442921880516,
   "color": 0.00023855922984198808,
   "ultima": -103.32451744106085,
   "dual_delta": -0.639831886450399,
   "dual_gamma": 0.0356813948993455
  },
  {
   "symbol": "SYNTHC98",
   "type": "call",
   "strike": 98.0,
   "expiry": "2026-11-07",
   "days_to_expiry": 60.0,
   "iv": 0.26314,
   "moneyness": 0.98,
   "price": 5.549281971320127,
   "delta": 0.612674537910795,
   "gamma": 0.03580572995389127,
   "vega": 15.488087309699097,
   "theta": -0.038390334765790866,
   "rho": 9.15915153201524,
   "lam": 11.040609236964848,
   "vanna": -0.26456339603527956,
   "vomma": 3.0992134619813667,
   "charm": 0.0003026353665305061,
   "veta": -0.13199163453131788,
   "speed": -0.0013277385733429633,
   "zomma": -0.12890619099282744,
   "color": 0.00029162075445731344,
   "ultima": -37.259261038396644,
   "dual_delta": -0.568552773671014,
   "dual_gamma": 0.03728210115982015
  },
  {
   "symbol": "SYNTHC100",
   "type": "call",
   "strike": 100.0,
   "expiry": "2026-11-07",
   "days_to_expiry": 60.0,
   "iv": 0.26,
   "moneyness": 1.0,
   "price": 4.436418588650739,
   "delta": 0.5387387956400971,
   "gamma": 0.03759622716586315,
   "vega": 16.068524487327814,
   "theta": -0.03875694363133153,
   "rho": 8.126705913757638,
   "lam": 12.143551941160387,
   "vanna": 0.009032602522462392,
   "vomma": -0.03643498678186093,
   "charm": -0.00031382075808959595,
   "veta": -0.13213873463465678,
   "speed": -0.0007307905694666299,
   "zomma": -0.14468612224162353,
   "color": 0.00031743302877945185,
   "ultima": -2.2209149765087175,
   "dual_delta": -0.49437460975358977,
   "dual_gamma": 0.03759622716586315
  },
  {
   "symbol": "SYNTHC102",
   "type": "call",
   "strike": 102.0,
   "expiry": "2026-11-07",
   "days_to_expiry": 60.0,
   "iv": 0.25714,
   "moneyness": 1.02,
   "price": 3.476118784738574,
   "delta": 0.4631775986766489,
   "gamma": 0.038046814995353465,
   "vega": 16.082232341761955,
   "theta": -0.03788753817918932,
   "rho": 7.0424615478782995,